{
  "schema_version": "1.0.0",
  "bundle_status": "migration_fixture",
  "case": {
    "case_id": "AMT-01",
    "legacy_ids": [],
    "title": "Antalya-Mediterranean Triangle 01",
    "case_role": "project_baseline",
    "resolution_status": "insufficient_data",
    "migration_status": "partial_fixture",
    "public_summary": "A retrospective single-witness account of a dark triangular object moving slowly and apparently silently at low estimated altitude near the Mediterranean coast of Turkey. No original event imagery, independent witness, exact site/date, or calibrated measurement is available.",
    "event": {
      "time": {
        "reported_description": "Summer 2004, approximately 21:00–22:00",
        "value_status": "reported",
        "normalized_start": null,
        "normalized_end": null,
        "precision": "season",
        "timezone": null,
        "unknown_reason": "The witness recalls summer 2004; the exact day and month have not been recovered."
      },
      "location": {
        "public_description": "Mediterranean coast of Turkey, somewhere near Antalya",
        "country_code": "TR",
        "value_status": "reported",
        "precision": "region",
        "latitude": null,
        "longitude": null,
        "unknown_reason": "The exact hotel, observer position, and path have not been recovered."
      }
    },
    "observation_modes": [
      "unaided_visual",
      "unaided_hearing",
      "human_sensory"
    ],
    "observer_groups": 1,
    "evidence_assessment": {
      "tier": "C",
      "tier_status": "proposed",
      "rubric_version": "1.0.0",
      "rationale": "Rich retrospective description, but no independent witness, original event media, exact site/date reconstruction, or instrumented measurements.",
      "dimensions": {
        "original_event_source": "missing",
        "observation_channels": "single human sensory account",
        "independent_observer_groups": 1,
        "geometry_constraint": "retrospective estimates",
        "timing_calibration": "none",
        "sensor_metadata": "none",
        "event_media": "none",
        "mundane_alternatives": "partially tested in project analysis",
        "contradictions": "not independently reviewed"
      },
      "review_ids": []
    },
    "discovery": {
      "collection_id": null,
      "query": null,
      "inclusion_reason": "Primary project baseline rather than a corpus-search result.",
      "exclusion_log_ref": null
    },
    "privacy": {
      "contains_personal_data": true,
      "raw_record_public": false,
      "exact_location_status": "unknown",
      "public_location_precision": "region",
      "consent_record_id": null
    },
    "claim_ids": [
      "OBS-AMT-SHAPE-001",
      "EST-AMT-LENGTH-001",
      "EST-AMT-PROXIMITY-001",
      "EST-AMT-PATH-001",
      "EST-AMT-DURATION-001",
      "DER-AMT-SPEED-001",
      "OBS-AMT-SOUND-001",
      "OBS-AMT-AIRFLOW-001",
      "OBS-AMT-BLACK-EXIST-001",
      "EST-AMT-BLACK-COUNT-001",
      "UNK-AMT-UPPER-GEOMETRY-001"
    ],
    "source_ids": [
      "SRC-AMT-SYNTHESIS-001"
    ],
    "asset_ids": [
      "ASSET-AMT-SKETCH-ORIGINAL-001",
      "ASSET-AMT-SKETCH-PUBLIC-001",
      "ASSET-AMT-SKETCH-PUBLIC-002",
      "ASSET-AMT-RECON-HERO-001"
    ],
    "revision": {
      "created_at": "2026-07-19",
      "updated_at": "2026-07-20",
      "content_version": "0.0.2-migration-fixture",
      "schema_version": "1.0.0"
    }
  },
  "claims": [
    {
      "claim_id": "OBS-AMT-SHAPE-001",
      "case_id": "AMT-01",
      "legacy_group_ids": ["OBS-AMT-001"],
      "type": "OBS",
      "statement": "The visible planform was remembered as an elongated triangular arrow.",
      "normalized": {
        "subject": "observed_object",
        "property": "visible_planform",
        "value_status": "reported",
        "value": "elongated_triangular_arrow"
      },
      "record_confidence": "high",
      "confidence_basis": "Visually salient feature repeatedly retained in the current account; this does not provide independent corroboration.",
      "status": "retained",
      "evidence_links": [
        {
          "source_id": "SRC-AMT-SYNTHESIS-001",
          "relation": "asserted_in",
          "locator": "docs/01-case-amt01/01-full-observation-record.md#4-geometry",
          "verification": "project_record_checked"
        }
      ],
      "relations": []
    },
    {
      "claim_id": "EST-AMT-LENGTH-001",
      "case_id": "AMT-01",
      "legacy_group_ids": ["EST-AMT-005"],
      "type": "EST",
      "statement": "The object's length was visually estimated at approximately 6–8 m.",
      "normalized": {
        "subject": "observed_object",
        "property": "length",
        "value_status": "estimated",
        "quantity": {
          "min": 6,
          "max": 8,
          "unit": "m",
          "unit_system": "SI",
          "raw_expression": "approximately 6–8 m"
        }
      },
      "record_confidence": "medium",
      "confidence_basis": "Retrospective visual scale estimate without recovered site calibration.",
      "status": "retained",
      "evidence_links": [
        {
          "source_id": "SRC-AMT-SYNTHESIS-001",
          "relation": "asserted_in",
          "locator": "docs/01-case-amt01/01-full-observation-record.md#4-geometry",
          "verification": "project_record_checked"
        }
      ],
      "relations": [],
      "estimate_basis": "Witness memory compared with the recalled path/lamp environment; exact geometry unknown."
    },
    {
      "claim_id": "EST-AMT-PROXIMITY-001",
      "case_id": "AMT-01",
      "legacy_group_ids": ["EST-AMT-015"],
      "type": "EST",
      "statement": "The closest lateral distance from the object's path was retrospectively estimated at approximately 15–20 m.",
      "normalized": {
        "subject": "event_observation",
        "property": "closest_lateral_distance_to_path",
        "value_status": "estimated",
        "quantity": {
          "min": 15,
          "max": 20,
          "unit": "m",
          "unit_system": "SI",
          "raw_expression": "approximately 15–20 m"
        }
      },
      "record_confidence": "low",
      "confidence_basis": "Retrospective visual estimate without recovered site calibration.",
      "status": "retained",
      "evidence_links": [
        {
          "source_id": "SRC-AMT-SYNTHESIS-001",
          "relation": "asserted_in",
          "locator": "docs/01-case-amt01/01-full-observation-record.md#9-estimates",
          "verification": "project_record_checked"
        }
      ],
      "relations": [],
      "estimate_basis": "Witness memory of the object's closest lateral passage; exact observer and path geometry are unrecovered."
    },
    {
      "claim_id": "EST-AMT-PATH-001",
      "case_id": "AMT-01",
      "legacy_group_ids": ["EST-AMT-012"],
      "type": "EST",
      "statement": "The visible path length was estimated at approximately 40–50 m.",
      "normalized": {
        "subject": "event_observation",
        "property": "visible_path_length",
        "value_status": "estimated",
        "quantity": {
          "min": 40,
          "max": 50,
          "unit": "m",
          "unit_system": "SI",
          "raw_expression": "approximately 40–50 m"
        }
      },
      "record_confidence": "medium",
      "confidence_basis": "Retrospective visual estimate; site and lamp spacing are unrecovered.",
      "status": "retained",
      "evidence_links": [
        {
          "source_id": "SRC-AMT-SYNTHESIS-001",
          "relation": "asserted_in",
          "locator": "docs/01-case-amt01/01-full-observation-record.md#7-motion",
          "verification": "project_record_checked"
        }
      ],
      "relations": [],
      "estimate_basis": "Witness memory of the path across the lamp-lit scene."
    },
    {
      "claim_id": "EST-AMT-DURATION-001",
      "case_id": "AMT-01",
      "legacy_group_ids": ["EST-AMT-012"],
      "type": "EST",
      "statement": "The observation duration was estimated at approximately 12–15 s.",
      "normalized": {
        "subject": "event_observation",
        "property": "duration",
        "value_status": "estimated",
        "quantity": {
          "min": 12,
          "max": 15,
          "unit": "s",
          "unit_system": "SI",
          "raw_expression": "approximately 12–15 s"
        }
      },
      "record_confidence": "medium",
      "confidence_basis": "Retrospective duration estimate without contemporaneous timing.",
      "status": "retained",
      "evidence_links": [
        {
          "source_id": "SRC-AMT-SYNTHESIS-001",
          "relation": "asserted_in",
          "locator": "docs/01-case-amt01/01-full-observation-record.md#7-motion",
          "verification": "project_record_checked"
        }
      ],
      "relations": [],
      "estimate_basis": "Witness memory; no clock, recording, or recovered event timestamp."
    },
    {
      "claim_id": "DER-AMT-SPEED-001",
      "case_id": "AMT-01",
      "legacy_group_ids": ["DER-AMT-013"],
      "type": "DER",
      "statement": "Using independent range extrema, the estimated average speed is approximately 2.7–4.2 m/s (9.6–15 km/h).",
      "normalized": {
        "subject": "observed_object",
        "property": "average_speed",
        "value_status": "derived",
        "quantity": {
          "min": 2.7,
          "max": 4.2,
          "unit": "m/s",
          "unit_system": "SI",
          "raw_expression": "40/15 to 50/12 m/s"
        }
      },
      "record_confidence": "medium",
      "confidence_basis": "Arithmetic is straightforward; reliability is dominated by the retrospective distance and duration estimates.",
      "status": "retained",
      "evidence_links": [],
      "relations": [
        {"relation": "derived_from", "target_id": "EST-AMT-PATH-001"},
        {"relation": "derived_from", "target_id": "EST-AMT-DURATION-001"}
      ],
      "derived_from": [
        "EST-AMT-PATH-001",
        "EST-AMT-DURATION-001"